{
  "schema": "avengine_m6_room_qualification_report_v1",
  "report_id": "blender_custom_two_zone_m6_audit_v1",
  "subject": {
    "room_id": "blender_custom_two_zone_v1",
    "revision": "controlled_geometry_v1",
    "qualification_scope": "acoustic_representation",
    "acoustic_representation_id": "custom_two_zone_acoustic_v1",
    "acoustic_representation_kind": "production_authority"
  },
  "evidence_basis": "audited_historical",
  "evidence_artifacts": [],
  "dimensions": {
    "visual_runtime_status": {
      "status": "pass",
      "summary": "The checked-in M1 controlled-room visual canary passed.",
      "evidence_refs": ["docs/roadmap/M1_STATUS.md"]
    },
    "navigation_status": {
      "status": "pass",
      "summary": "The declared controlled-room navmesh and connectivity checks passed M1.",
      "evidence_refs": ["docs/roadmap/M1_STATUS.md"]
    },
    "acoustic_geometry_status": {
      "status": "pass",
      "summary": "The explicit non-AABB controlled surface passed M3 geometry qualification.",
      "evidence_refs": ["docs/roadmap/M3_STATUS.md"]
    },
    "material_binding_status": {
      "status": "pass",
      "summary": "Per-triangle coverage, activation, and RLR material readback passed the controlled M3 canary.",
      "evidence_refs": ["docs/roadmap/M3_STATUS.md"]
    },
    "ray_leakage_status": {
      "status": "pass",
      "summary": "Declared door/window and wall-control rays passed CPU and native RLR checks.",
      "evidence_refs": ["docs/roadmap/M3_STATUS.md"]
    },
    "physical_material_truth_status": {
      "status": "controlled_profile",
      "summary": "Synthetic controlled coefficients are authoritative for this canary, but are not measured real-room truth.",
      "evidence_refs": ["docs/roadmap/M3_STATUS.md"]
    },
    "episode_feasibility_status": {
      "status": "not_run",
      "summary": "The earlier two-source M5 episode passed, but the M6 one-active-of-N source program has not run.",
      "evidence_refs": ["docs/roadmap/M5_STATUS.md"],
      "blocker_code": "m6_one_active_of_n_not_run"
    }
  },
  "placement_feasibility": {
    "status": "not_run",
    "summary": "Five-point floor support, horizontal clearance, and frustum-leakage placement probes have not run for the M6 route.",
    "evidence_refs": [],
    "blocker_code": "m6_placement_probe_not_run",
    "checks": [],
    "failure_reasons": ["m6_placement_probe_not_run"]
  },
  "acoustic_diagnostics": {
    "raw_source_identity": {
      "status": "pass",
      "summary": "The checked-in real-surface source is hash-bound by the controlled room manifest.",
      "evidence_refs": ["docs/roadmap/M3_STATUS.md"]
    },
    "declared_derivation_integrity": {
      "status": "pass",
      "summary": "The deterministic M3 compiler and package provenance checks passed.",
      "evidence_refs": ["docs/roadmap/M3_STATUS.md"]
    },
    "visual_to_acoustic_spatial_parity": {
      "status": "pass",
      "summary": "The controlled acoustic surface is compiled from the declared visual real surface.",
      "evidence_refs": ["docs/roadmap/M3_STATUS.md"]
    },
    "solver_loadability": {
      "status": "pass",
      "summary": "Fresh native RLR contexts loaded the controlled package repeatedly.",
      "evidence_refs": ["docs/roadmap/M3_STATUS.md"]
    },
    "topology_diagnostics": {
      "status": "pass",
      "summary": "Controlled topology diagnostics passed the M3 production gate.",
      "evidence_refs": ["docs/roadmap/M3_STATUS.md"]
    },
    "opening_and_enclosure_checks": {
      "status": "pass",
      "summary": "Opening and blocking controls passed the controlled M3 ray gate.",
      "evidence_refs": ["docs/roadmap/M3_STATUS.md"]
    }
  },
  "dataset_admission": false,
  "admission_blockers": [
    "episode_feasibility_status=not_run",
    "placement_feasibility=not_run"
  ],
  "provenance": {
    "source_records": [
      "examples/m1/rooms/blender_custom/room_manifest.json",
      "docs/roadmap/M3_STATUS.md",
      "docs/roadmap/M5_STATUS.md"
    ],
    "notes": "Audited historical statuses are preserved; a fresh M6 evidence bundle must bind current runtime hashes before admission."
  }
}
