{
  "schema": "avengine_m6_room_qualification_report_v1",
  "report_id": "replicacad_apt_0_m6_audit_v1",
  "subject": {
    "room_id": "replicacad_apt_0",
    "revision": "replica_cad_dataset_1_5_layout_apt_0",
    "qualification_scope": "acoustic_representation",
    "acoustic_representation_id": "replicacad_apt_0_acoustic_proxy_v1",
    "acoustic_representation_kind": "derived_proxy"
  },
  "evidence_basis": "audited_historical",
  "evidence_artifacts": [],
  "dimensions": {
    "visual_runtime_status": {
      "status": "not_run",
      "summary": "A local native load smoke exists, but no portable M6 RGB/PBR evidence bundle is committed.",
      "evidence_refs": ["docs/superpowers/status/2026-07-09-mixamo-replicacad-expansion-status.md"],
      "blocker_code": "replicacad_formal_visual_not_run"
    },
    "navigation_status": {
      "status": "not_run",
      "summary": "apt_0 navmesh loading was smoke-tested locally; formal route and placement evidence has not run.",
      "evidence_refs": ["docs/superpowers/status/2026-07-09-mixamo-replicacad-expansion-status.md"],
      "blocker_code": "replicacad_formal_navigation_not_run"
    },
    "acoustic_geometry_status": {
      "status": "not_run",
      "summary": "No declared non-AABB apt_0 acoustic proxy has been built and qualified; a generic topology audit is not a substitute.",
      "evidence_refs": [],
      "blocker_code": "replicacad_acoustic_proxy_not_built"
    },
    "material_binding_status": {
      "status": "not_run",
      "summary": "Controlled or semantic material mapping, per-triangle coverage, and RLR readback have not run.",
      "evidence_refs": [],
      "blocker_code": "replicacad_material_binding_not_run"
    },
    "ray_leakage_status": {
      "status": "not_run",
      "summary": "Scene-specific opening, wall, floor, ceiling, and leakage rays have not been authored or run.",
      "evidence_refs": [],
      "blocker_code": "replicacad_rays_not_run"
    },
    "physical_material_truth_status": {
      "status": "unqualified",
      "summary": "The target is controlled_approximation or semantic_mapping_approximation; neither has been activated and verified.",
      "evidence_refs": [],
      "blocker_code": "replicacad_material_truth_unqualified"
    },
    "episode_feasibility_status": {
      "status": "not_run",
      "summary": "Actor, listener, and source placement plus the M6 source program have not run in apt_0.",
      "evidence_refs": [],
      "blocker_code": "replicacad_episode_not_run"
    }
  },
  "placement_feasibility": {
    "status": "not_run",
    "summary": "Five-point support, clearance, and frustum leakage probes have not run in apt_0.",
    "evidence_refs": [],
    "blocker_code": "replicacad_placement_not_run",
    "checks": [],
    "failure_reasons": ["replicacad_placement_not_run"]
  },
  "acoustic_diagnostics": {
    "raw_source_identity": {
      "status": "not_run",
      "summary": "External stage hashes are declared in the registry but have not been rebound by an M6 run.",
      "evidence_refs": [],
      "blocker_code": "replicacad_raw_identity_not_run"
    },
    "declared_derivation_integrity": {
      "status": "not_run",
      "summary": "The apt_0 proxy derivation has not executed.",
      "evidence_refs": [],
      "blocker_code": "replicacad_derivation_not_run"
    },
    "visual_to_acoustic_spatial_parity": {
      "status": "not_run",
      "summary": "No derived proxy exists for spatial parity checks.",
      "evidence_refs": [],
      "blocker_code": "replicacad_spatial_parity_not_run"
    },
    "solver_loadability": {
      "status": "not_run",
      "summary": "No apt_0 acoustic package has been uploaded to RLR.",
      "evidence_refs": [],
      "blocker_code": "replicacad_solver_load_not_run"
    },
    "topology_diagnostics": {
      "status": "not_run",
      "summary": "A preliminary generic audit found issues, but the declared acoustic topology policy has not run.",
      "evidence_refs": [],
      "blocker_code": "replicacad_topology_policy_not_run"
    },
    "opening_and_enclosure_checks": {
      "status": "not_run",
      "summary": "apt_0 openings and enclosure expectations are not yet declared.",
      "evidence_refs": [],
      "blocker_code": "replicacad_openings_not_run"
    }
  },
  "dataset_admission": false,
  "admission_blockers": [
    "visual_runtime_status=not_run",
    "navigation_status=not_run",
    "acoustic_geometry_status=not_run",
    "material_binding_status=not_run",
    "ray_leakage_status=not_run",
    "physical_material_truth_status=unqualified",
    "episode_feasibility_status=not_run",
    "placement_feasibility=not_run"
  ],
  "provenance": {
    "source_records": [
      "docs/superpowers/status/2026-07-09-mixamo-replicacad-expansion-status.md",
      "examples/registry/rooms/room_registry.json"
    ],
    "notes": "The local dataset path is supplied only through AVENGINE_REPLICACAD_ROOT; no private absolute path is promoted."
  }
}
