{
  "schema": "avengine_m6_room_qualification_report_v1",
  "report_id": "mp3d_17DRP5sb8fy_raw_m6_audit_v1",
  "subject": {
    "room_id": "habitat_mp3d_example_17DRP5sb8fy",
    "revision": "raw_v1_plus_declared_proxy_v2_research",
    "qualification_scope": "acoustic_representation",
    "acoustic_representation_id": "mp3d_17DRP5sb8fy_raw_source_v1",
    "acoustic_representation_kind": "raw_source"
  },
  "evidence_basis": "audited_historical",
  "evidence_artifacts": [],
  "dimensions": {
    "visual_runtime_status": {
      "status": "pass",
      "summary": "The raw MP3D scene passed the existing visual capture gates.",
      "evidence_refs": ["docs/roadmap/M1_STATUS.md", "docs/roadmap/M5_1_STATUS.md"]
    },
    "navigation_status": {
      "status": "pass",
      "summary": "The raw scene navmesh and existing route passed the current center-point visual/navigation gates.",
      "evidence_refs": ["docs/roadmap/M5_1_STATUS.md"]
    },
    "acoustic_geometry_status": {
      "status": "fail",
      "summary": "Raw acoustic upload is rejected by 458 zero-area faces in node58_mesh58_primitive0.",
      "evidence_refs": ["docs/roadmap/M5_1_STATUS.md"],
      "blocker_code": "mp3d_raw_zero_area_primitive"
    },
    "material_binding_status": {
      "status": "blocked",
      "summary": "Triangle coverage used research placeholder slots; semantic mapping and RLR readback qualification are incomplete.",
      "evidence_refs": ["docs/roadmap/M5_1_STATUS.md"],
      "blocker_code": "mp3d_raw_material_binding_unqualified"
    },
    "ray_leakage_status": {
      "status": "not_run",
      "summary": "Scene-specific opening and leakage checks were not declared for the raw scan.",
      "evidence_refs": ["docs/roadmap/M5_1_STATUS.md"],
      "blocker_code": "mp3d_raw_rays_not_run"
    },
    "physical_material_truth_status": {
      "status": "unqualified",
      "summary": "Neutral research coefficients are placeholders, not MP3D material truth.",
      "evidence_refs": ["docs/roadmap/M5_1_STATUS.md"],
      "blocker_code": "mp3d_raw_material_truth_unqualified"
    },
    "episode_feasibility_status": {
      "status": "fail",
      "summary": "The visual route is feasible, but the immutable raw representation cannot run the acoustic episode in RLR.",
      "evidence_refs": ["docs/roadmap/M5_1_STATUS.md"],
      "blocker_code": "mp3d_raw_solver_upload_failed"
    }
  },
  "placement_feasibility": {
    "status": "not_run",
    "summary": "Existing center-point checks do not include five-point support, horizontal body clearance, or frustum leakage.",
    "evidence_refs": ["docs/roadmap/M5_1_STATUS.md"],
    "blocker_code": "mp3d_full_placement_probe_not_run",
    "checks": [],
    "failure_reasons": ["mp3d_center_point_only"]
  },
  "acoustic_diagnostics": {
    "raw_source_identity": {
      "status": "pass",
      "summary": "The immutable raw GLB hash and raw compiler identity agree.",
      "evidence_refs": ["docs/roadmap/M5_1_STATUS.md"]
    },
    "declared_derivation_integrity": {
      "status": "not_run",
      "summary": "This report describes the immutable raw source, not a derived proxy.",
      "evidence_refs": [],
      "blocker_code": "raw_source_has_no_derivation"
    },
    "visual_to_acoustic_spatial_parity": {
      "status": "pass",
      "summary": "The raw acoustic extraction preserves raw source arrays and transforms.",
      "evidence_refs": ["docs/roadmap/M5_1_STATUS.md"]
    },
    "solver_loadability": {
      "status": "fail",
      "summary": "RLR rejects the zero-area primitive during raw upload.",
      "evidence_refs": ["docs/roadmap/M5_1_STATUS.md"],
      "blocker_code": "mp3d_raw_solver_load_failed"
    },
    "topology_diagnostics": {
      "status": "fail",
      "summary": "Raw diagnostics: 458 degenerate, 148 duplicate, 8338 boundary, and 624 non-manifold edges.",
      "evidence_refs": ["docs/roadmap/M5_1_STATUS.md"],
      "blocker_code": "mp3d_raw_topology_failed"
    },
    "opening_and_enclosure_checks": {
      "status": "not_run",
      "summary": "Raw scan openings and enclosure behavior are not qualified.",
      "evidence_refs": [],
      "blocker_code": "mp3d_raw_openings_not_run"
    }
  },
  "dataset_admission": false,
  "admission_blockers": [
    "acoustic_geometry_status=fail",
    "material_binding_status=blocked",
    "ray_leakage_status=not_run",
    "physical_material_truth_status=unqualified",
    "episode_feasibility_status=fail",
    "placement_feasibility=not_run",
    "acoustic_diagnostics.declared_derivation_integrity=not_run",
    "acoustic_diagnostics.solver_loadability=fail",
    "acoustic_diagnostics.topology_diagnostics=fail",
    "acoustic_diagnostics.opening_and_enclosure_checks=not_run"
  ],
  "provenance": {
    "source_records": [
      "examples/m1/rooms/habitat_mp3d_example/room_manifest.json",
      "docs/roadmap/M5_1_STATUS.md"
    ],
    "notes": "Failure applies to the raw acoustic representation, not to MP3D visual/navigation usability or the permanent value of this scene."
  }
}
